{
  "$id": "https://openfairy.local/schemas/protocol/v1/artifact.created.json",
  "$schema": "https://json-schema.org/draft/2020-12/schema",
  "additionalProperties": true,
  "properties": {
    "actor": {
      "pattern": "^(user|agent|tool|system|subagent:[A-Za-z0-9_.-]+|workflow:[A-Za-z0-9_.-]+)$",
      "type": "string"
    },
    "id": {
      "pattern": "^evt_[0-9A-HJKMNP-TV-Z]{26}$",
      "type": "string"
    },
    "labels": {
      "additionalProperties": true,
      "properties": {
        "residency": {
          "enum": [
            "local-only",
            "region-restricted",
            "global-ok"
          ],
          "type": "string"
        },
        "sensitivity": {
          "enum": [
            "public",
            "internal",
            "personal",
            "secret"
          ],
          "type": "string"
        }
      },
      "required": [
        "sensitivity",
        "residency"
      ],
      "type": "object"
    },
    "payload": {
      "additionalProperties": true,
      "properties": {
        "hash": {
          "minLength": 1,
          "type": "string"
        },
        "labels": {
          "additionalProperties": true,
          "properties": {
            "residency": {
              "enum": [
                "local-only",
                "region-restricted",
                "global-ok"
              ],
              "type": "string"
            },
            "sensitivity": {
              "enum": [
                "public",
                "internal",
                "personal",
                "secret"
              ],
              "type": "string"
            }
          },
          "required": [
            "sensitivity",
            "residency"
          ],
          "type": "object"
        },
        "mime": {
          "minLength": 1,
          "type": "string"
        },
        "origin": {
          "minLength": 1,
          "type": "string"
        },
        "path": {
          "minLength": 1,
          "type": "string"
        }
      },
      "required": [
        "path",
        "hash",
        "mime",
        "labels",
        "origin"
      ],
      "type": "object"
    },
    "provenance": {
      "pattern": "^(user|agent|tool:[^\\s]+|web:[^\\s]+|mcp:[^\\s]+)$",
      "type": "string"
    },
    "sid": {
      "pattern": "^ses_[0-9A-HJKMNP-TV-Z]{26}$",
      "type": "string"
    },
    "ts": {
      "pattern": "^\\d{4}-\\d{2}-\\d{2}T\\d{2}:\\d{2}:\\d{2}\\.\\d{3}Z$",
      "type": "string"
    },
    "turn": {
      "minimum": 0,
      "type": "integer"
    },
    "type": {
      "const": "artifact.created"
    },
    "v": {
      "const": 1
    }
  },
  "required": [
    "v",
    "id",
    "sid",
    "turn",
    "ts",
    "actor",
    "type",
    "provenance",
    "labels",
    "payload"
  ],
  "title": "Fairy protocol event artifact.created v1",
  "type": "object"
}
