{
  "actor": "agent",
  "id": "evt_01J00000000000000000000031",
  "labels": {
    "residency": "global-ok",
    "sensitivity": "internal"
  },
  "payload": {
    "hash": "sha256:def",
    "labels": {
      "residency": "global-ok",
      "sensitivity": "internal"
    },
    "mime": "text/markdown",
    "origin": "tool:research",
    "path": "artifacts/report.md"
  },
  "provenance": "agent",
  "sid": "ses_01J00000000000000000000000",
  "ts": "2026-07-02T10:00:00.000Z",
  "turn": 1,
  "type": "artifact.created",
  "v": 1
}
